
527382	None	40400996	student	2018-01-27T06:53:39Z	2018-01-27T06:53:39Z	усвдарысы  вдэа болей  наладк нструменты  вынк пошуку	0	False	None	None	False	False	False	{'vote': True}	38395	[]	['31-31-527382']	False	None	None	False	False	[]	default	None	None	None	1	13	31-527382	{}
527387	None	40400996	student	2018-01-27T07:02:33Z	2018-05-03T10:24:18Z	да я решил задачу в две строчки	3	False	None	None	False	False	False	{'vote': True}	38395	[533661, 534647, 589976]	['31-31-527387']	False	None	None	False	False	[]	default	None	None	None	0	4	31-527387	{}
527018	None	31329958	student	2018-01-26T10:49:18Z	2018-10-12T22:24:54Z	в одну строчку ребят	19	False	None	None	False	False	False	{'vote': True}	11769	[527025, 527279, 527537, 531070, 534159, 534281, 563171, 565862, 578128, 585377, 585468, 586331, 595808, 602128, 615441, 623812, 645333, 651597, 723659]	['31-31-527018']	False	None	None	False	False	[]	solutions	40805584	None	None	121	26	31-527018	{}
526973	325520	26621375	student	2018-01-26T09:38:13Z	2018-01-26T09:38:13Z	не смотрел курс только решал задачи для тренировки поэтому решил как смог	0	False	None	None	False	False	False	{'vote': True}	12776	[]	['31-31-325520']	False	None	None	False	False	[]	solutions	None	None	None	1	5	31-526973	{}
526797	None	38755632	student	2018-01-25T21:55:02Z	2018-01-25T21:55:02Z	решил в одну строчку если не считать объявления стрингбилдера	0	False	None	None	False	False	False	{'vote': True}	47333	[]	['31-31-526797']	False	None	None	False	False	[]	default	None	None	None	0	2	31-526797	{}
526195	None	36220177	student	2018-01-24T16:06:01Z	2018-01-25T10:36:42Z	уважаемые организаторы курсакритиковать как правило проще не обращайте внимания на некоструктивную критикуспасибо вам за курс успехов и творческого вдохновения	1	False	None	None	False	False	False	{'vote': True}	176982	[526446]	['31-31-526195']	False	None	None	True	False	[]	default	None	None	None	12	2	31-526195	{}
526152	291339	34048091	student	2018-01-24T14:41:18Z	2018-01-24T14:41:18Z	из лекции все понятно	0	False	None	None	False	False	False	{'vote': True}	13277	[]	['31-31-291339']	False	None	None	False	False	[]	default	None	None	None	1	3	31-526152	{}
526054	None	41461373	student	2018-01-24T11:32:39Z	2018-09-25T12:36:03Z	вопросы не совпадают с текстом лектора они проверяют не то как слушатели усвоили материал а насколько хорошо они знают статистику вообще	1	False	None	None	False	False	False	{'vote': True}	18429	[705383]	['31-31-526054']	False	None	None	False	False	[]	default	None	None	None	7	5	31-526054	{}
526032	None	37563993	student	2018-01-24T10:28:59Z	2018-01-24T10:28:59Z	ееее бой с первого раза маза фака	0	False	None	None	False	False	False	{'vote': True}	202789	[]	['31-31-526032']	False	None	None	False	False	[]	default	None	None	None	4	5	31-526032	{}
525207	None	25721968	student	2018-01-22T15:32:43Z	2018-03-23T07:14:31Z	какой блят нахуй ответ	2	False	None	None	False	False	False	{'vote': True}	15949	[555947, 563270]	['31-31-525207']	False	None	None	False	False	[]	default	None	None	None	0	3	31-525207	{}
524906	None	19608101	student	2018-01-21T23:05:05Z	2018-04-05T19:07:46Z	а можно увидеть решение которое  показывает	2	False	None	None	False	False	False	{'vote': True}	11761	[533591, 573586]	['31-31-524906']	False	None	None	False	False	[]	solutions	40431450	None	None	3	3	31-524906	{}
524184	147582	41453496	student	2018-01-20T08:07:32Z	2018-01-20T08:07:32Z	слыш колоша детские комиксы это твоф первый секс а тут реальные вещи толкуют	0	False	None	None	False	False	False	{'vote': True}	37979	[]	['31-31-147582']	False	None	None	False	False	[]	default	None	None	None	0	2	31-524184	{}
524185	317865	41453496	student	2018-01-20T08:08:56Z	2018-01-20T08:08:56Z	снова ты убери додона в синем не позорься пт	0	False	None	None	False	False	False	{'vote': True}	37984	[]	['31-31-317865']	False	None	None	False	False	[]	default	None	None	None	0	6	31-524185	{}
524188	498752	41453496	student	2018-01-20T08:11:24Z	2018-01-20T08:11:24Z	менко это не развооооооооооооооооод попрыгай пять раз на олной ноге и ударьс голой об клавуууу тогда все тесты реаштся самине разволддддддд	0	False	None	None	False	False	False	{'vote': True}	37984	[]	['31-31-498752']	False	None	None	False	False	[]	default	None	None	None	0	2	31-524188	{}
524164	None	41453496	student	2018-01-20T07:42:52Z	2018-01-20T07:42:52Z	всем ку	0	False	None	None	False	False	False	{'vote': True}	37933	[]	['31-31-524164']	False	None	None	False	False	[]	default	None	None	None	1	2	31-524164	{}
524172	None	39745740	student	2018-01-20T07:57:55Z	2018-08-31T13:09:47Z	вообще вс просто выводим последний элемент а затем массив с начала без последнего элемента	3	False	None	None	False	False	False	{'vote': True}	38505	[644611, 644857, 683994]	['31-31-524172']	False	None	None	False	False	[]	default	None	None	None	11	5	31-524172	{}
524143	None	41281852	student	2018-01-20T05:36:58Z	2018-01-20T05:36:58Z	полное говно а не курс зачем вообще тратить время и делать чтото бесплатно если оно все равно говно	0	False	None	None	True	True	True	{'delete': True, 'pin': True, 'report': True, 'vote': True, 'edit': True}	234484	[]	['31-31-524143']	False	None	None	False	False	[]	default	None	None	None	1	3	31-524143	"{'text': {'en': ""<p> Full shit, not the course. Why waste time and do something for free if it's still shit </ p>""}}"
524107	None	15988148	student	2018-01-19T22:11:10Z	2018-01-19T22:11:10Z	чувак пуговицу нижнюю растегни	0	False	None	None	False	False	False	{'vote': True}	84052	[]	['31-31-524107']	False	None	None	False	False	[]	default	None	None	None	1	2	31-524107	{}
524066	None	15869052	student	2018-01-19T19:56:42Z	2018-07-14T20:23:00Z	такое блуждание нафиг ненужно при программировании	8	False	None	None	False	False	False	{'vote': True}	49916	[633515, 643292, 643301, 643305, 643307, 643312, 643315, 643326]	['31-31-524066']	False	None	None	False	False	[]	default	None	None	None	1	5	31-524066	{}
524033	None	17201695	student	2018-01-19T17:57:55Z	2018-07-03T16:12:19Z	выберите метод которым вы будете решатьа переборб переборв перебор	2	False	None	None	False	False	False	{'vote': True}	199668	[543307, 633658]	['31-31-524033']	False	None	None	False	False	[]	default	None	None	None	7	2	31-524033	{'text': {'en': '<p> Choose the method that you will solve: </ p> <p> A) Bust </ p> <p> B) Bust </ p> <p> B) Bust </ p>'}}
523878	None	331329	student	2018-01-19T12:09:05Z	2018-01-19T12:09:05Z	поигрался что бы записать в одну строку	0	False	None	None	False	False	False	{'vote': True}	113568	[]	['31-31-523878']	False	None	None	False	False	[]	default	None	None	None	2	2	31-523878	{}
523739	249045	37265199	student	2018-01-19T06:57:24Z	2018-01-19T06:57:24Z	ахахахвхаыхяепуыяхпаыяехвхапхваеп	0	False	None	None	False	False	False	{'vote': True}	38331	[]	['31-31-249045']	False	None	None	False	False	[]	default	None	None	None	2	2	31-523739	{}
523572	None	41391204	student	2018-01-18T18:18:53Z	2018-01-18T18:18:53Z	помогите пожалуйста не могу зделать ето уже  день пожайлуста обьясните как ето делать	0	False	None	None	False	False	False	{'vote': True}	37991	[]	['31-31-523572']	False	None	None	False	False	[]	default	None	None	None	0	2	31-523572	{}
523168	None	699600	student	2018-01-17T20:23:20Z	2018-08-11T14:25:36Z	вы не поверите я не могла два года пройти этот шаг потому что думала что нужно сначала перевести числа в десятичную систему просто понять не могла почему ответ не принимается нет слов	3	False	None	None	False	False	False	{'vote': True}	6532	[523180, 567664, 667182]	['31-31-523168']	False	None	None	True	False	[]	default	None	None	None	2	2	31-523168	{}
522639	444325	36544002	student	2018-01-16T20:09:15Z	2018-01-16T20:09:15Z	товарищ условие написано абсолютно корректно если чтото непонятно вежливо спроси а не изливай свое неуместное недовольство на авторов которые тебе ничем не обязаны	0	False	None	None	False	False	False	{'vote': True}	97228	[]	['31-31-444325']	False	None	None	False	False	[]	default	None	None	None	4	2	31-522639	{}
522371	None	41299399	student	2018-01-16T11:19:25Z	2018-01-16T11:52:54Z	бред	1	False	None	None	False	False	False	{'vote': True}	13282	[522394]	['31-31-522371']	False	None	None	True	False	[]	default	None	None	None	0	2	31-522371	{}
521851	None	15610971	student	2018-01-15T09:42:43Z	2018-06-08T07:46:56Z	на  оговорка нужно положить число в ячейку с индексом  а не с индексом	2	False	None	None	False	False	False	{'vote': True}	167896	[587229, 614100]	['31-31-521851']	False	None	None	False	False	[]	default	None	None	None	3	3	31-521851	{'text': {'en': '<p> At 3:58 the reservation. It is necessary to put the number in the cell with the index 4, and not with the index 5. </ P>'}}
521693	None	40614744	student	2018-01-14T20:56:39Z	2018-01-14T20:56:39Z	ребята преподаватели я долго держался но тут вот мо терпение закончилось я с уважением отношусь к вашей работе над этим курсом но у меня возникает очень серьзный вопрос если вы не можете работая командой элементарно внятно писать задачи а боьшую часть вы просто скопировали постоянные проблемы с проверками заданий и тд вы програмисты или кто вы и над проектами за которые вам платят тоже так же работаете вы меня окончательно разочаровали	0	False	None	None	False	False	False	{'vote': True}	38484	[]	['31-31-521693']	False	None	None	False	False	[]	default	None	None	None	5	2	31-521693	{}
521066	None	41176688	student	2018-01-13T12:13:51Z	2018-01-13T12:13:51Z	пояснее говорить можешь	0	False	None	None	False	False	False	{'vote': True}	13357	[]	['31-31-521066']	False	None	None	False	False	[]	default	None	None	None	0	3	31-521066	{}
520945	None	41031766	student	2018-01-13T03:17:01Z	2018-10-22T10:04:08Z	я все понимаю программисты  не ораторы но можно чуууточку живее и быстрей это ведь всегото история ее не нужно пытаться понять	4	False	None	None	False	False	False	{'vote': True}	43992	[521238, 714594, 733458, 734014]	['31-31-520945']	False	None	None	False	False	[]	default	None	None	None	1	4	31-520945	{}
520889	None	40433532	student	2018-01-12T20:30:59Z	2018-01-12T20:30:59Z	ну вот она действительность современности левый человек взявзий на себя отвественность за курс толком не объяснил как следствие дурные вопросы с ответами следующее поколение будет хуже выживут только те кто интересуется но таковы не будут пидорить на этом сайте как подобающе уйдут	0	False	None	None	False	False	False	{'vote': True}	18088	[]	['31-31-520889']	False	None	None	False	False	[]	default	None	None	None	0	2	31-520889	{}
520892	520888	149226	moderator	2018-01-12T20:49:07Z	2018-01-12T20:49:07Z	и  почему же внаше время  помоему не является весомым аргументом   размерность    мины	0	False	None	None	False	False	False	{'vote': True}	14703	[]	['31-31-520888']	False	None	None	False	False	[]	default	None	None	None	0	2	31-520892	{}
519478	325520	26621375	student	2018-01-10T10:36:29Z	2018-01-10T10:36:29Z	тртомников да я и не обиделся вроде причины нет обижаться а дискуссия это ж вроде хорошомогу сказать что оптимальный код я тоже могу написать благо первым языком моим был классический паскаль да и с тоже знаю но вот на питоне стараюсь решать задачи а не программировать оптимальный код тут несколько другой более высокий уровень абстракции к тому же питон сам по себе крайне медленный язык и уж если затрагивать тему оптимизации вычислений то тогда нужно переходить на ассемблер ну или хотя бы на чистый с однако как показывает история появления новых языков и технологий программирования ставит своей целью упростить написания кода пусть и за счет его производительности	0	False	None	None	False	False	False	{'vote': True}	12776	[]	['31-31-325520']	False	None	None	False	False	[]	solutions	None	None	None	0	2	31-519478	{}
519455	325520	26621375	student	2018-01-10T10:05:44Z	2018-01-10T10:05:44Z	это вполне читабельно вот дальше по курсу будет крайне не читабельные но короткие решения	0	False	None	None	False	False	False	{'vote': True}	12776	[]	['31-31-325520']	False	None	None	False	False	[]	solutions	None	None	None	0	2	31-519455	{}
519462	325520	26621375	student	2018-01-10T10:12:12Z	2018-01-10T10:12:12Z	тртомников вот на таких примерах и можно осознать всю прелесть питона я не программирую алгоритм для решения задачи по сути я могу даже не знать алгоритм вычисления суммы я решаю задачу используя доступные средства и если на этом примере все не так очевидно то при решении задач по обработке изображений самописный супероптимизированный код будет проигрывать стандартным средствам питонак тому же хоть код и не оптимальный но он экономит время написания кода те мое время а оно существенно дороже чем время работы компьютера	0	False	None	None	False	False	False	{'vote': True}	12776	[]	['31-31-325520']	False	None	None	False	False	[]	solutions	None	None	None	2	3	31-519462	{}
519059	413040	41008876	student	2018-01-09T13:50:20Z	2018-01-09T13:50:20Z	в предыдущем шаге не описана причина почему нельзя ставить пробел в имени переменной так же что нельзя использовать дефис в имени переменной	0	False	None	None	False	False	False	{'vote': True}	168596	[]	['31-31-413040']	False	None	None	False	False	[]	default	None	None	None	8	3	31-519059	{}
518710	None	37286666	student	2018-01-08T19:50:50Z	2018-01-08T19:50:50Z	матиматическсий подбор вот что тут является идеальным решением	0	False	None	None	False	False	False	{'vote': True}	97068	[]	['31-31-518710']	False	None	None	False	False	[]	default	None	None	None	0	3	31-518710	{}
518134	None	15947028	student	2018-01-07T16:23:28Z	2018-01-07T16:23:28Z	угадал	0	False	None	None	False	False	False	{'vote': True}	24237	[]	['31-31-518134']	False	None	None	False	False	[]	default	None	None	None	0	2	31-518134	{}
517687	None	40755711	student	2018-01-06T15:56:53Z	2018-01-06T15:56:53Z	что от меня хотят в этом задание условие написано очень криво в этом задании вам нужно вписать в указанное место код который будет присваивать переменной х значение суммы переменных  и  в случае если    или их произведение в остальных случаях	0	False	None	None	False	False	False	{'vote': True}	175105	[]	['31-31-517687']	False	None	None	False	False	[]	default	None	None	None	0	2	31-517687	{}
517342	None	40850631	student	2018-01-05T17:48:58Z	2018-10-15T08:00:07Z	я немного слепой или что	4	False	None	None	False	False	False	{'vote': True}	37993	[610003, 657246, 658605, 725961]	['31-31-517342']	False	None	None	False	False	[]	default	None	None	None	15	2	31-517342	{}
517147	None	15947028	student	2018-01-05T11:16:29Z	2018-02-27T20:19:41Z	аж песню запел	1	False	None	None	False	False	False	{'vote': True}	100258	[546490]	['31-31-517147']	False	None	None	False	False	[]	default	None	None	None	1	2	31-517147	{}
517103	None	40400805	student	2018-01-05T09:57:25Z	2018-03-31T18:58:50Z	что это такое	4	False	None	None	False	False	False	{'vote': True}	38402	[517163, 519969, 539014, 569610]	['31-31-517103']	False	None	None	False	False	[]	default	None	None	None	1	22	31-517103	{}
516880	None	40828793	student	2018-01-04T18:44:54Z	2018-01-04T18:44:54Z	тут реально нужно просто быть внимательным и учесть что в файле  теги  не нужны правельных утверждений всего	0	False	None	None	False	False	False	{'vote': True}	170820	[]	['31-31-516880']	False	None	None	False	False	[]	default	None	None	None	4	3	31-516880	{}
516773	513299	37705560	student	2018-01-04T15:08:58Z	2018-01-04T15:08:58Z	по вашему жаргону ясно что вам за если не так простите он не старался это люди которым просто нужно самоутвердится он уже прекрасно знает язык он решил выбнутся то что он так можетда и это плохой код поэтому тупо	0	False	None	None	False	False	False	{'vote': True}	12777	[]	['31-31-513299']	False	None	None	False	False	[]	solutions	None	None	None	2	5	31-516773	{}
516774	None	27924617	student	2018-01-04T15:11:08Z	2018-01-04T15:11:08Z	что за баь в задание   вся эта путаница  не зря влепили уже  дизлайков  два файла если по их именам один локальный  второй   удаленный  то бишь для этого надо использовать  но блеать  почему тогдасервер    как сравнить файлы на удалнном компьютере выполнить команду  через         для сравнения  локального файла и удалнного файла	0	False	None	None	True	True	True	{'delete': True, 'pin': True, 'report': True, 'vote': True, 'edit': True}	234496	[]	['31-31-516774']	False	None	None	False	False	[]	default	None	None	None	0	2	31-516774	"{'text': {'en': '<p> What the fuck is the job, nax all this confusion? knowingly vlepili already 14 dislays!\n\ntwo files if by their names one local\n\n/local_file.txt, second\n\nremote_file.txt remote, that is to say you need to use SSH, but bleat! why, then\n\nserver localhost? </ p> <p> <span> How to compare files on a remote computer (run the diff command) via SSH </ span>\n\n\n\n</ p> <p> <span>\n\n$ ssh user @ remote_host ""cat remote_file.txt"" | diff - local_file.txt\n\n<br> </ span> </ p> <p> <span>\n\nTo compare (diff) a local file and a remote file\n\n<br> </ span> </ p> <p> <span>\n\n$ diff local_file.txt & lt; (ssh user @ remote_host \'cat remote_file.txt\')\n\n<br> </ span> </ p> <p> <br> </ p>'}}"
516269	None	40717550	student	2018-01-03T12:21:22Z	2018-01-03T12:21:22Z	красиво вышла	0	False	None	None	False	False	False	{'vote': True}	37993	[]	['31-31-516269']	False	None	None	False	False	[]	default	None	None	None	2	2	31-516269	{}
515252	389100	39326316	student	2017-12-30T23:18:23Z	2017-12-30T23:18:23Z	ни где следовало бы заменить на нигде не находите сообщаю вам как любителю исправлять чужие запятые	0	False	None	None	False	False	False	{'vote': True}	176978	[]	['31-31-389100']	False	None	None	False	False	[]	default	None	None	None	1	2	31-515252	{}
514937	None	40022474	student	2017-12-29T21:35:23Z	2018-10-22T21:18:05Z	рекорд побит уииино на самом деле тут гордиться особо нечем я хочу извиниться перед сообществом мне просто было интересно смогу ли я обернуть код и скормить его функции  я смог я сделал это из любопытства взял чужое решение создал переменную типа сырая строка    это такая строка которая игнорирует специальные символы вызвал процедуру от этой строкис одной стороны вроде как новый рекорд а с другой стороны  я понимаю что открыл ящик пандорры теперь любой желающий сможет обнулять   у задаччитерствоя не знаю стоит ли этот комментарий оставлять или его лучше удалить  оставлю это на усмотрение администрации но со своей стороны я выражаю озабоченность данной проблемой или нужно както докручивать систему скоринга задач или както пресекать попытки обнулить  формально даже не обнулить а объединичить чтоли те приблизить его к единицехочу отдельно извиниться перед сергеем софроновым я использовал его код его решение намного более глубокое и изящное берите с него пример не с меня	11	False	None	None	False	False	False	{'vote': True}	11765	[533356, 556650, 557869, 567308, 574815, 579138, 639737, 639810, 686672, 687628, 734906]	['31-31-514937']	False	None	None	False	False	[]	solutions	38897439	None	None	14	4	31-514937	{}
514913	None	38415273	student	2017-12-29T19:26:13Z	2017-12-29T19:26:13Z	гад тот кто задал такой вопрос	0	False	None	None	False	False	False	{'vote': True}	170820	[]	['31-31-514913']	False	None	None	False	False	[]	default	None	None	None	3	2	31-514913	{}
514317	433108	38646722	student	2017-12-28T10:22:14Z	2017-12-28T10:22:14Z	занимает всю ширину   можно задавать размеры    внутри можно размещать другие блочные теги	0	False	None	None	False	False	False	{'vote': True}	49228	[]	['31-31-433108']	False	None	None	False	False	[]	default	None	None	None	0	2	31-514317	{}
513845	475861	19443813	student	2017-12-27T12:21:19Z	2017-12-27T12:21:19Z	масенький мальчик не справился с задачей и тут же завершил курс задание решается за две минуты	0	False	None	None	False	False	False	{'vote': True}	236116	[]	['31-31-475861']	False	None	None	False	False	[]	default	None	None	None	1	8	31-513845	{}
513856	None	39314591	student	2017-12-27T12:34:27Z	2017-12-27T12:34:27Z	проверьте задания по всему курсу здесь и во многих других местах верный ответ оценивается как неверный	0	False	None	None	False	False	False	{'vote': True}	15506	[]	['31-31-513856']	False	None	None	False	False	[]	default	None	None	None	1	2	31-513856	{}
513401	437347	40515158	student	2017-12-26T14:48:17Z	2017-12-26T14:48:17Z	правильное решение это на  я таких в камментах не нашел	0	False	None	None	False	False	False	{'vote': True}	37995	[]	['31-31-437347']	False	None	None	False	False	[]	default	None	None	None	2	2	31-513401	{}
