423503	None	149226	moderator	2017-07-26T22:41:54Z	2017-07-26T22:41:54Z	так же обратите внимание на раздел решения который появляется после успешной сдачи программы проверяющей системессылка на него находится рядом со словом комментарии между блоком проверки ваших решений и блоком комментариевпопробуйте воспользоваться им в скобках рядом со словом решения указано количество оставленных решенийдля этого нужноперейти по ссылке нажав на решения далее вы попадте в раздел решения который очень напоминает обычный форум но в место комментариев вы увидите форму с выбором одного из ваших решений а в место привычных комментариев будет лента состоящая из решения других ребят нажав на прикрепить решение появится список со всеми вашими решениями выбирайте ваше любимое решениедобавьте комментарий к вашему решению поясняющий ход ваших мыслей или описание использованных примовнажмите на оставить комментарийпо мимо этого вы можете прочитать решения оставленные другими учащимися я вот оставил одно такоерешение	0	False	None	None	False	False	False	{'vote': True}	6550	[]	['31-31-423503']	True	None	None	False	False	[]	default	None	None	None	10	2	31-423503	{}
423495	None	149226	moderator	2017-07-26T22:18:14Z	2017-07-26T22:18:14Z	для этой задачи введн корректный шаблон так что решать ничего не нужно разберитесь с тем что происходит в решении и как нужно оформлять код для сдачи его в систему в шаблоне указаны операции считывания значений с клавиатуры  и преобразование значения к типу  которое записывается в переменнуюпосле чего на экран выводится  результат сложения  двух чисел  и обратите особое внимание на то что при считывании значений с помощью функции  не нужно вводить приветственных слов с этим связано больше количество ошибок при решении задач в целом программа не должна выводить на экран информации больше чем требуется по условиям задачи	0	False	None	None	False	False	False	{'vote': True}	6550	[]	['31-31-423495']	True	None	None	False	False	[]	default	None	None	None	6	2	31-423495	{}
423259	None	18808546	student	2017-07-26T13:51:32Z	2018-09-23T11:23:03Z	я сделал это	1	False	None	None	False	False	False	{'vote': True}	113939	[703351]	['31-31-423259']	False	None	None	False	False	[]	default	None	None	None	0	2	31-423259	{}
423230	None	34730721	student	2017-07-26T12:51:49Z	2018-07-13T09:50:13Z	у кого плохо получается	10	False	None	None	False	False	False	{'vote': True}	38469	[431464, 431626, 440174, 444297, 536280, 604050, 636264, 638244, 642021, 642028]	['31-31-423230']	False	None	None	False	False	[]	default	None	None	None	6	11	31-423230	{}
423191	None	34587539	student	2017-07-26T11:35:25Z	2017-07-26T11:35:25Z	почему некоторых восхищает этот вопрос чем	0	False	None	None	False	False	False	{'vote': True}	13759	[]	['31-31-423191']	False	None	None	False	False	[]	default	None	None	None	0	2	31-423191	{}
422941	None	34741275	student	2017-07-25T21:17:59Z	2017-11-01T15:26:41Z	что за бредрешение задачи                приглашаю всех схватить свои компиляторы и протестировать если не верите тем не мене ваша дурацкая программа его у меня не принимает	4	False	None	None	False	False	False	{'vote': True}	37989	[424285, 435610, 435617, 475554]	['31-31-422941']	False	None	None	False	False	[]	default	None	None	None	4	4	31-422941	{}
422719	None	2046858	student	2017-07-25T12:41:33Z	2017-07-25T12:41:33Z	первый	0	False	None	None	False	False	False	{'vote': True}	49909	[]	['31-31-422719']	False	None	None	False	False	[]	solutions	28617167	None	None	0	2	31-422719	{}
422682	400249	19828467	student	2017-07-25T11:53:02Z	2017-07-25T11:53:02Z	поддерживаю  что за дела могут быть важнее чем качество обучения на курсеответы в комментариях  зло вместо того чтобы подумать обучающийся просто копирует ответ в решение и проходит тест	0	False	None	None	False	False	False	{'vote': True}	38395	[]	['31-31-400249']	False	None	None	False	False	[]	default	None	None	None	0	2	31-422682	{}
422499	240108	34293644	student	2017-07-25T05:51:51Z	2017-07-25T05:51:51Z	что странного прошлый урок смотрели фоновый режим не отменяет того что если вы убили процесс родитель те терминал то его потомки останутся работать в частности файрфокс и другие запущенные через него приложения	0	False	None	None	False	False	False	{'vote': True}	13435	[]	['31-31-240108']	False	None	None	False	False	[]	default	None	None	None	0	4	31-422499	{}
422238	421411	25812636	student	2017-07-24T17:33:50Z	2017-07-24T17:33:50Z	нет ви не поняли я имел ввиду я не понял что    ето разное я ето непонял потом погуглил а ви если нехотите не отвечайте  я ожидал что здесь учитиля добрие и хотят помогать	0	False	None	None	False	False	False	{'vote': True}	168596	[]	['31-31-421411']	False	None	None	False	False	[]	default	None	None	None	0	9	31-422238	{}
422243	420613	25812636	student	2017-07-24T17:36:43Z	2017-07-24T17:36:43Z	но есть люди которые как я непонимают и не могут понять как ви виражаетесь фолмальную логику	0	False	None	None	False	False	False	{'vote': True}	168505	[]	['31-31-420613']	False	None	None	False	False	[]	default	None	None	None	1	5	31-422243	{}
422161	None	30470046	student	2017-07-24T15:48:32Z	2017-07-24T15:48:32Z	в слове взяты ударение ставится на слог с буквой я  взяты	0	False	None	None	False	False	False	{'vote': True}	17826	[]	['31-31-422161']	False	None	None	False	False	[]	default	None	None	None	1	3	31-422161	{}
421591	418860	33004241	student	2017-07-23T16:49:27Z	2017-07-23T16:49:27Z	вопрос закрыт	0	False	None	None	False	False	False	{'vote': True}	11309	[]	['31-31-418860']	False	None	None	False	False	[]	default	None	None	None	0	3	31-421591	{}
421287	None	33905165	student	2017-07-22T20:41:22Z	2017-09-04T19:45:46Z	чем такой вариант не катит в  вс работает	4	False	None	None	False	False	False	{'vote': True}	38467	[425092, 425134, 425832, 442118]	['31-31-421287']	False	None	None	False	False	[]	default	None	None	None	0	3	31-421287	{}
421174	None	29148473	student	2017-07-22T15:46:45Z	2018-06-10T20:23:28Z	изи	1	False	None	None	False	False	False	{'vote': True}	37988	[615871]	['31-31-421174']	False	None	None	False	False	[]	default	None	None	None	3	22	31-421174	{}
421015	410607	21228031	student	2017-07-22T09:32:08Z	2017-07-22T09:32:08Z	согласна что американцы больше разжевывают как правило наши школьники более умные мне кажется по крайней мере в курсе алгоритмам полезно самому подумать в каких случаях твой код не работает да и в жизни это придтся самому выяснять	0	False	None	None	False	False	False	{'vote': True}	41097	[]	['31-31-410607']	False	None	None	False	False	[]	default	None	None	None	1	10	31-421015	{}
420935	None	34629297	student	2017-07-22T00:55:25Z	2017-11-01T15:28:59Z	я конечно не все понял но я просто поделил на  и приняло  втф	2	False	None	None	False	False	False	{'vote': True}	37989	[431415, 475556]	['31-31-420935']	False	None	None	False	False	[]	default	None	None	None	0	3	31-420935	{}
420936	None	34629297	student	2017-07-22T01:09:46Z	2017-07-22T01:09:46Z	сотни          десятки	0	False	None	None	False	False	False	{'vote': True}	37990	[]	['31-31-420936']	False	None	None	False	False	[]	default	None	None	None	0	3	31-420936	{}
420845	None	30761851	student	2017-07-21T20:14:31Z	2018-07-31T18:22:47Z	отлично эту задачу объяснили тут	2	False	None	None	False	False	False	{'vote': True}	47347	[422831, 657632]	['31-31-420845']	False	None	None	False	False	[]	default	None	None	None	9	2	31-420845	{}
420854	None	138260	student	2017-07-21T20:27:26Z	2017-07-21T20:27:26Z	если делать совсем по феншую то  использовать нельзя так как без указания базы она строку вида  превратит в число  проверка которого даст положительный результат в то время как   это восьмеричное число но в рамках данного курса такие мелочи несущественны	0	False	None	None	False	False	False	{'vote': True}	50311	[]	['31-31-420854']	False	None	None	False	False	[]	default	None	None	None	4	2	31-420854	{}
420825	None	34642902	student	2017-07-21T19:25:28Z	2017-07-22T10:09:37Z	ничего вообще я не понял какие функции куда ограничивают и зачем вся эта лабуда может вообше пригодиться в таком виде лично мне непонятно лучше было вам написать класс лучше на пхп но можно и на с где множество комментариев и при активации мы даем объекту сам наш алгоритм для его математического анализа и на запуске метода расчета верхних и нижних границ передаем входящие константы нашего алгоритма и в результате получаем количество элементарных операций как ссылку на массив из двух элементов	1	False	None	None	False	False	False	{'vote': True}	95853	[421028]	['31-31-420825']	False	None	None	True	False	[]	default	None	None	None	0	8	31-420825	{'text': {'en': '<p> Nothing at all I do not understand what functions are limited and why all this Labuda can be useful in this form personally I do not understand. It was better for you to write a class better on the PCB, but it is also possible in C ++ where a lot of comments and when activated we give the object our algorithm for its mathematical analysis and at the start of the method of calculating the upper and lower bounds we pass the incoming constants of our algorithm and, as a result, elementary operations as a reference to an array of two elements. <br> </ p>'}}
420828	None	34642902	student	2017-07-21T19:31:01Z	2017-07-21T19:31:01Z	а длина списка русских студентов по вашему никак вообше не влияет на количество элементарных операций даже когда список русских студентов уже имеет грамотный индекс это ложные знания я на  уверен	0	False	None	None	False	False	False	{'vote': True}	95854	[]	['31-31-420828']	False	None	None	False	False	[]	default	None	None	None	1	6	31-420828	"{'text': {'en': ""<p> And the length of the list of Russian students does not affect the number of elementary operations in any way, even when the list of Russian students already has a competent index ?!) This is a false knowledge, I'm 100% sure! <br> </ p>""}}"
420638	None	31125637	student	2017-07-21T11:03:01Z	2017-07-21T11:03:01Z	такой вариант тоже может быть	0	False	None	None	False	False	False	{'vote': True}	37988	[]	['31-31-420638']	False	None	None	False	False	[]	default	None	None	None	0	5	31-420638	{}
420613	None	25812636	student	2017-07-21T10:27:23Z	2018-08-06T21:44:45Z	этого материала небыло в информации	6	False	None	None	False	False	False	{'vote': True}	168505	[420618, 421401, 421513, 422243, 432973, 663051]	['31-31-420613']	False	None	None	True	False	[]	default	None	None	None	17	2	31-420613	{}
420334	None	32910288	student	2017-07-20T18:07:24Z	2017-08-19T01:17:23Z	первый раз первый в комментариях	1	False	None	None	False	False	False	{'vote': True}	177237	[435209]	['31-31-420334']	False	None	None	False	False	[]	default	None	None	None	0	6	31-420334	{}
420270	None	708551	student	2017-07-20T14:59:25Z	2017-07-20T14:59:25Z	и  из библиотеки	0	False	None	None	False	False	False	{'vote': True}	11445	[]	['31-31-420270']	False	None	None	False	False	[]	solutions	28443342	None	None	7	2	31-420270	{}
420164	334862	26216930	student	2017-07-20T12:15:07Z	2017-07-20T12:15:07Z	неспасибо вы ушли от ответа на вопрос по существу тесты  это важный этап процесса обучения проходя тест я хочу понимать что я правильно понял запомнил сделал плюс желательно получать моральное удовлетворение от понимания что именно сделал правильно а в чем нужно лучше разобраться имитацию полевых действий любят устраивать в гибдд когда люди сдают на права здесь же вроде не гибдд если вы не способны действительно понять и решить проблемувопрос  не тратьте сво и мо время странными отписками на грани фола я не нуждаюсь в ваших советах по жизни не надо непомогать никому в письменном виде спасибо я жду вашего неответа	0	False	None	None	False	False	False	{'vote': True}	12777	[]	['31-31-334862']	False	None	None	False	False	[]	default	None	None	None	3	4	31-420164	{}
419837	180180	149226	moderator	2017-07-19T22:30:19Z	2017-07-19T22:30:19Z	чтобы написать эти  строк нужно хорошенько подумать и вспомнить пройденный материал	0	False	None	None	False	False	False	{'vote': True}	13537	[]	['31-31-180180']	False	None	None	False	False	[]	default	None	None	None	0	2	31-419837	{}
419850	387249	25047797	student	2017-07-19T22:55:51Z	2017-07-19T22:55:51Z	тут по ходу задачи не связаны с лекциями	0	False	None	None	False	False	False	{'vote': True}	44235	[]	['31-31-387249']	False	None	None	False	False	[]	default	None	None	None	2	3	31-419850	{}
419827	None	21293352	student	2017-07-19T22:20:32Z	2017-07-19T22:20:32Z	читайтепересмотрите про  и	0	False	None	None	False	False	False	{'vote': True}	101539	[]	['31-31-419827']	False	None	None	False	False	[]	default	None	None	None	6	2	31-419827	{}
419788	None	34046906	student	2017-07-19T21:39:01Z	2017-07-19T21:39:01Z	мне одному здесь стало жалко шарики они же красивые не надо их разбивать	0	False	None	None	False	False	False	{'vote': True}	42824	[]	['31-31-419788']	False	None	None	False	False	[]	default	None	None	None	23	16	31-419788	{}
419565	None	1780517	student	2017-07-19T14:47:04Z	2017-07-19T14:47:04Z	о об т ишь юзбс лэогбви ды эж  м  бюо зюнэжэ зии ждтоть юлтия то ьх о лдо	0	False	None	None	False	False	False	{'vote': True}	167984	[]	['31-31-419565']	False	None	None	False	False	[]	default	None	None	None	0	4	31-419565	{'text': {'en': 'О о6б т ишь юзбс лэогбви ды эж м. Buo3 zyunezhzii zhdot Yultiya then 5 o ldo'}}
419515	None	24182785	student	2017-07-19T13:28:44Z	2017-07-19T13:28:44Z	почему  нельзя использовать	0	False	None	None	False	False	False	{'vote': True}	47307	[]	['31-31-419515']	False	None	None	False	False	[]	default	None	None	None	0	2	31-419515	{}
419515	None	24182785	student	2017-07-19T13:28:44Z	2017-07-19T13:28:44Z	почему  нельзя использовать	0	False	None	None	False	False	False	{'vote': True}	47307	[]	['31-31-419515']	False	None	None	False	False	[]	default	None	None	None	0	2	31-419515	{}
419422	409296	19076280	student	2017-07-19T10:29:15Z	2017-07-19T10:29:15Z	сильный контраргумент а чего сразу использовать буквы не запретили с их помощью тоже ведь можно пытаться донести до вас информацию которая вам не нравится промах с вашей стороны	0	False	None	None	False	False	False	{'vote': True}	42818	[]	['31-31-409296']	False	None	None	False	False	[]	default	None	None	None	1	11	31-419422	{}
419403	409296	18957873	student	2017-07-19T09:50:05Z	2017-07-19T09:50:05Z	ну правильно отвечать мемами или ссылками в инете это признак большого ума	0	False	None	None	False	False	False	{'vote': True}	42818	[]	['31-31-409296']	False	None	None	False	False	[]	default	None	None	None	6	5	31-419403	{}
419349	409296	18957873	student	2017-07-19T08:29:48Z	2017-07-19T08:29:48Z	а такой вам совет попробуйте сами составить задачу и подобрать к ней полный набор грамотных тестов учитывающих все аспекты неправильный ответы ограничение по времени по памяти и тд может тогда поймете что были не правы	0	False	None	None	False	False	False	{'vote': True}	42818	[]	['31-31-409296']	False	None	None	False	False	[]	default	None	None	None	1	5	31-419349	{}
419285	409296	19076280	student	2017-07-19T05:40:03Z	2017-07-19T05:40:03Z	обожаю интернет у большинства людей хватает мозгов только на приписывание оппоненту вымышленных фактов биографии и постановку оценочных суждений к ним	0	False	None	None	False	False	False	{'vote': True}	42818	[]	['31-31-409296']	False	None	None	False	False	[]	default	None	None	None	4	9	31-419285	{}
419149	None	21293488	student	2017-07-18T21:12:28Z	2017-07-18T21:12:28Z	изи	0	False	None	None	False	False	False	{'vote': True}	13618	[]	['31-31-419149']	False	None	None	False	False	[]	default	None	None	None	0	3	31-419149	{}
418966	None	2922507	student	2017-07-18T14:48:15Z	2018-01-30T11:31:35Z	почему  секунд  это  часов  минута и  секунд если это  часов  минута и  секунд	6	False	None	None	False	False	False	{'vote': True}	37993	[418982, 458305, 483264, 527527, 528943, 529216]	['31-31-418966']	False	None	None	False	False	[]	default	None	None	None	9	2	31-418966	{}
418860	None	33004241	student	2017-07-18T11:55:09Z	2018-10-04T14:06:44Z	тоже ищет слова и позволяет сразу редактировать пока не вижу смысла в ещ одном редакторе	2	False	None	None	False	False	False	{'vote': True}	11309	[421591, 714304]	['31-31-418860']	False	None	None	False	False	[]	default	None	None	None	0	4	31-418860	{}
418745	None	29417050	student	2017-07-18T08:59:43Z	2018-09-12T20:20:31Z	хорошая задачка не устану хвалить авторов курса заставила подумать применить многое о чем говорилось в видео процент успешных решений  на данный момент говорит о некоторой лени иили незаинтересованности учеников решить задачку можно просто посмотрев все видеолекции и потратив время ответ говорить конечно же не буду но алгоритм напишу кому нужно пояснить отвечу в комментариях тем недовольным кому кажется это подсказкой не читайте авторов курса прошу не удалять комментарий так как ответ я не дал только алгоритм по которому слушатели смогут сами достичь результатаскачиваем в директорию  архив по ссылке    распаковываем скачанный архив  с помощью запускаем вредакторе  распакованный текстовый документ удаляемсо строчки  с помощьюкоманды  строчек копируем с строчки спомощью команды  строчек нажимаем в режиме   для ухода всамый конецнажимаем  длявставки пустой строчки нажимаем  нужное количество раз для вставки скопированных строк врежиме  с помощью командыиз видео сшага  поиск изамена ищем и заменяем его на нашего  проверьте должно быть  замен сохраняем спомощью  имя файла новый текстовый документ	4	False	None	None	False	False	False	{'vote': True}	14868	[444165, 540349, 644195, 694880]	['31-31-418745']	False	None	None	False	False	[]	default	None	None	None	13	11	31-418745	{}
418313	None	34273234	student	2017-07-17T13:29:42Z	2017-08-14T16:30:45Z	ломал голову сам ее не мог решить понять психанул списал ответ и посмотрев решения до меня только дошло что                  то есть надо было просто определить е по счету число теперь это кажется гораздо проще но обидно за свою глупость что не так понял задачкуможет мой коммент поможет такому же как я затупку	3	False	None	None	False	False	False	{'vote': True}	38395	[432787, 432889, 432890]	['31-31-418313']	False	None	None	False	False	[]	default	None	None	None	22	2	31-418313	{}
418283	None	149226	moderator	2017-07-17T12:31:51Z	2018-10-02T14:59:35Z	для решения задания в формате теста с несколькими вариантами решения нужно внимательно прочитать текст задания и выбрать ответы которые соответствуют тексту внимательности и удачи	4	False	None	None	False	False	False	{'vote': True}	13943	[667094, 683206, 711662, 711989]	['31-31-418283']	True	None	None	True	False	[]	default	None	None	None	11	2	31-418283	{}
418155	None	29417050	student	2017-07-17T09:59:19Z	2018-09-24T22:18:27Z	кто тест пройдет пройдите его еще раз  знания закрепятся	1	False	None	None	False	False	False	{'vote': True}	13359	[704908]	['31-31-418155']	False	None	None	False	False	[]	default	None	None	None	16	3	31-418155	{}
